<?xml version="1.0" encoding="UTF-8"?>

<!-- 应用外部DTD文件 -->

<!DOCTYPE books SYSTEM "books.dtd">

<books>
	<book id="1">
		<name>西游记</name>
		<auther>吴承恩</auther>
		<price>50.0</price>
	</book>
	<book id="2">
		<name>水浒传</name>
		<auther>施耐庵</auther>
		<price>80.0</price>
	</book>
	<book id="3">
		<name>三国演义</name>
		<auther>罗贯中</auther>
		<price>100.0</price>
	</book>
	<book id="4">
		<name>红楼梦</name>
		<auther>曹雪芹</auther>
		<price>150.0</price>
	</book>
</books>